{
  "version": 1,
  "uuid": "00000000-0000-4000-8000-000000000003",
  "name": "Image Loop",
  "screen": "720x1080",
  "loop": {
    "file": "loop.png",
    "is_image": true
  },
  "intro": {
    "enabled": true,
    "file": "intro.mp4",
    "duration": 3000000
  },
  "overlay": {
    "type": "image",
    "options": {
      "appear_time": 200000,
      "duration": 1000000,
      "image": "overlay.png"
    }
  }
}
